<?xml version="1.0" encoding="UTF-8"?>
<!DOCTYPE manifesto SYSTEM "../tpc2/manifesto.dtd">
<manifesto>
    <meta>
        <id>web2018::A77628::t2</id>
        <tit>Gerar website multi-página apartir de um ficheiro XML</tit>
        <subtit>Relatório inserido no TPC3 da cadeira de Desenvolvimento de Aplicações Web 2018/19</subtit>
        <begDate>02/10/18</begDate>
        <endDate>09/10/18</endDate>
        <supervisor>
            <nome>José Carlos Ramalho</nome>
            <website>http://www4.di.uminho.pt/~jcr/</website>
        </supervisor>
    </meta>
    <equipa>
        <membro>
            <nome>Armando Santos</nome>
            <email>a77628@alunos.uminho.pt</email>
            <numero>a77628</numero>
            <foto path="https://scontent.fopo3-1.fna.fbcdn.net/v/t1.0-9/15439852_1314705308550881_3914792405067568463_n.jpg?_nc_cat=108&amp;oh=9dfc810d0ca6dea7401952652a282beb&amp;oe=5C1D7E12">foto de perfil</foto>
            <website>https://github.com/bolt12</website>
        </membro>  
    </equipa>
    <resumo>
        <para>
            Este trabalho consiste na criação de uma página <i>web</i> apartir de um ficheiro XML. O ficheiro XML
            utilizado contém o Corão.
        </para>
        <para>
            O objetivo é o de criar uma página inicial (index.html) que possui o índice para os vários Suras com um link para cada das
            suas páginas.
        </para>
    </resumo>
    <resultados>
        <resultado url="manifesto.t3.xml">manifesto.t3.xml</resultado>
        <resultado url="manifesto.t3.html">manifesto.t3.html</resultado>
        <resultado url="quran.xsl">quran.xsl</resultado>
        <resultado url="website/index.html">index.html</resultado>
    </resultados>
</manifesto>